{
  "$schema": "https://json-schema.org/draft/2020-12/schema",
  "$id": "https://lichen.system/schemas/rag_build/CorpusDoc.schema.json",
  "title": "CorpusDoc",
  "type": "object",
  "required": ["version", "doc_id", "doc_type", "title", "text"],
  "properties": {
    "version": { "type": "string", "const": "1.0" },
    "doc_id": { "type": "string", "minLength": 1 },
    "doc_type": { "enum": ["protocol", "reflection", "essay"] },
    "title": { "type": "string" },
    "tags": { "type": "array", "items": { "type": "string" }, "maxItems": 20 },
    "text": { "type": "string", "minLength": 1 },
    "source_uri": { "type": "string", "format": "uri" },
    "created_at": { "type": "string", "format": "date-time" },
    "updated_at": { "type": "string", "format": "date-time" }
  },
  "additionalProperties": false
}
